[
  {
    "id": "urban_legends_online",
    "name": "Urban Legends Online",
    "canonical_url": "https://urbanlegendsonline.com/",
    "docs_or_dataset_url": "https://urbanlegendsonline.com/",
    "source_type": "discovery_reference",
    "api_status": "reference_only",
    "auth_required": false,
    "rate_limit_info": "Standard web rate-limiting; no bulk harvesting or scraping permitted.",
    "content_format": "HTML",
    "supported_research_purpose": "Discovery of contemporary urban legends, ghost stories, rumors, and motif identification.",
    "geographic_or_cultural_coverage": ["Global", "North America", "International"],
    "licensing_info": "All rights reserved on modern editorial narrative text; traditional folk motifs are public domain.",
    "rights_assessment_status": "permission_required",
    "full_text_reuse_verified": false,
    "retain_metadata_only": true,
    "last_checked_date": "2026-10-29",
    "implementation_status": "reference_only",
    "known_limitations": "No public API or structured feed; proprietary retellings; full-text ingestion strictly prohibited without express permission."
  },
  {
    "id": "folklore_ai_github",
    "name": "Folklore-ai GitHub Repository",
    "canonical_url": "https://github.com/AkshayGMys/Folklore-ai",
    "docs_or_dataset_url": "https://github.com/AkshayGMys/Folklore-ai/blob/main/README.md",
    "source_type": "open_source_reference",
    "api_status": "reference_only",
    "auth_required": false,
    "rate_limit_info": "Standard GitHub web and API rate limits apply.",
    "content_format": "Python code / Model prompts",
    "supported_research_purpose": "Conceptual reference for AI-assisted folklore generation grounded in Indian mythological narrative themes.",
    "geographic_or_cultural_coverage": ["IN"],
    "licensing_info": "Subject to repository license inspection; code and prompt design reference only.",
    "rights_assessment_status": "needs_rights_review",
    "full_text_reuse_verified": false,
    "retain_metadata_only": true,
    "last_checked_date": "2026-10-29",
    "implementation_status": "reference_only",
    "known_limitations": "Contains application code and prompts, not an authenticated historical folklore corpus; synthetic outputs cannot be treated as authentic folklore."
  },
  {
    "id": "wikimedia_wikipedia_api",
    "name": "Wikimedia / Wikipedia REST API",
    "canonical_url": "https://en.wikipedia.org/",
    "docs_or_dataset_url": "https://www.mediawiki.org/wiki/API:REST_API",
    "source_type": "encyclopedic_api",
    "api_status": "documented_api",
    "auth_required": false,
    "rate_limit_info": "Up to 200 requests/sec with polite custom User-Agent header.",
    "content_format": "JSON",
    "supported_research_purpose": "Entity summaries, documented folklore variants, alternate names, cultural classifications, and bibliographic references.",
    "geographic_or_cultural_coverage": ["Global", "IN", "US", "JP", "MX", "IE", "GB", "BR", "GR", "CN", "NG", "KR", "PH", "ID", "EG", "DE"],
    "licensing_info": "Creative Commons Attribution-ShareAlike (CC BY-SA 4.0 / 3.0); requires proper attribution.",
    "rights_assessment_status": "approved",
    "full_text_reuse_verified": true,
    "retain_metadata_only": false,
    "last_checked_date": "2026-10-29",
    "implementation_status": "registered_planned",
    "known_limitations": "Secondary encyclopedic synthesis; presence on Wikipedia does not imply historical veracity or supernatural reality."
  },
  {
    "id": "wikidata_sparql",
    "name": "Wikidata SPARQL Query Service",
    "canonical_url": "https://www.wikidata.org/",
    "docs_or_dataset_url": "https://query.wikidata.org/sparql",
    "source_type": "knowledge_graph_api",
    "api_status": "documented_api",
    "auth_required": false,
    "rate_limit_info": "Max 60-second query execution timeout; limit concurrent requests to 5; descriptive User-Agent required.",
    "content_format": "SPARQL JSON",
    "supported_research_purpose": "Structured entity linking (Q-identifiers), geographic coordinates, cross-lingual labels, and thematic ontologies.",
    "geographic_or_cultural_coverage": ["Global"],
    "licensing_info": "Creative Commons CC0 1.0 Universal (Public Domain Dedication).",
    "rights_assessment_status": "public_domain_verified",
    "full_text_reuse_verified": true,
    "retain_metadata_only": false,
    "last_checked_date": "2026-10-29",
    "implementation_status": "registered_planned",
    "known_limitations": "Queries must be strictly constrained to prevent timeouts; crowdsourced knowledge graph requires validation against source records."
  },
  {
    "id": "library_of_congress_api",
    "name": "Library of Congress JSON/YAML API",
    "canonical_url": "https://www.loc.gov/",
    "docs_or_dataset_url": "https://www.loc.gov/apis/json-and-yaml/",
    "source_type": "national_library_api",
    "api_status": "documented_api",
    "auth_required": false,
    "rate_limit_info": "Standard polite throttling (10-20 requests/second); no API key required for public endpoint.",
    "content_format": "JSON",
    "supported_research_purpose": "American folklore collections, oral histories (American Folklife Center), historical newspaper accounts (Chronicling America).",
    "geographic_or_cultural_coverage": ["US", "Global"],
    "licensing_info": "Catalog metadata is dedicated to the public domain (CC0); digital items vary according to collection copyright.",
    "rights_assessment_status": "metadata_only",
    "full_text_reuse_verified": false,
    "retain_metadata_only": true,
    "last_checked_date": "2026-10-29",
    "implementation_status": "registered_planned",
    "known_limitations": "Item-level rights must be checked individually; full text is not universally available or rights-cleared."
  },
  {
    "id": "internet_archive",
    "name": "Internet Archive API & Metadata Service",
    "canonical_url": "https://archive.org/",
    "docs_or_dataset_url": "https://archive.org/developers/",
    "source_type": "digital_library_api",
    "api_status": "documented_api",
    "auth_required": false,
    "rate_limit_info": "Polite rate-limiting; HTTP 429 backoff required on burst queries.",
    "content_format": "JSON",
    "supported_research_purpose": "Digitized public domain folklore anthologies, 19th-century myth collections, and historical provenance tracking.",
    "geographic_or_cultural_coverage": ["Global", "GB", "US", "DE", "IN", "IE"],
    "licensing_info": "Item-specific rights; metadata is open; texts must be individually confirmed as pre-1929 public domain works.",
    "rights_assessment_status": "needs_rights_review",
    "full_text_reuse_verified": false,
    "retain_metadata_only": true,
    "last_checked_date": "2026-10-29",
    "implementation_status": "registered_planned",
    "known_limitations": "Hosting on archive.org does not imply public domain status; scans frequently contain modern editorial or copyright restrictions."
  },
  {
    "id": "myths_of_ireland",
    "name": "Myths of Ireland Structured Dataset",
    "canonical_url": "https://www.mythsofireland.com/",
    "docs_or_dataset_url": "https://www.mythsofireland.com/dataset/",
    "source_type": "open_dataset",
    "api_status": "public_dataset",
    "auth_required": false,
    "rate_limit_info": "Static file download; no operational query limits.",
    "content_format": "JSON / CSV",
    "supported_research_purpose": "Structured index of Irish mythological beings, places, stories, narrative cycles, and relationships.",
    "geographic_or_cultural_coverage": ["IE"],
    "licensing_info": "Creative Commons Attribution 4.0 International (CC BY 4.0) for the downloadable index dataset.",
    "rights_assessment_status": "approved",
    "full_text_reuse_verified": true,
    "retain_metadata_only": true,
    "last_checked_date": "2026-10-29",
    "implementation_status": "registered_planned",
    "known_limitations": "Ireland-specific coverage only; provides an entity and story index, not full-length narrative text retellings."
  },
  {
    "id": "nichibunken_yokai_db",
    "name": "Nichibunken Yōkai Database",
    "canonical_url": "https://www.nichibun.ac.jp/en/db/category/yokai/",
    "docs_or_dataset_url": "https://www.nichibun.ac.jp/ja/db/category/yokai/",
    "source_type": "academic_database",
    "api_status": "searchable_catalogue",
    "auth_required": false,
    "rate_limit_info": "Web search query limits; automated bulk harvesting prohibited.",
    "content_format": "HTML",
    "supported_research_purpose": "Scholarly research on Japanese yōkai folklore, supernatural phenomena, historical folklore literature, and citations.",
    "geographic_or_cultural_coverage": ["JP"],
    "licensing_info": "Institutional copyright held by International Research Center for Japanese Studies (Nichibunken).",
    "rights_assessment_status": "metadata_only",
    "full_text_reuse_verified": false,
    "retain_metadata_only": true,
    "last_checked_date": "2026-10-29",
    "implementation_status": "reference_only",
    "known_limitations": "No public REST API; Japanese primary documentation; intended for bibliographic citation and scholarly reference."
  },
  {
    "id": "japan_search",
    "name": "Japan Search (NDL Cultural Heritage Platform)",
    "canonical_url": "https://jpsearch.go.jp/",
    "docs_or_dataset_url": "https://jpsearch.go.jp/static/developer/introduction/en.html",
    "source_type": "cultural_heritage_api",
    "api_status": "documented_api",
    "auth_required": false,
    "rate_limit_info": "Public REST and SPARQL endpoints; API keys available for high-throughput clients.",
    "content_format": "JSON-LD / SPARQL JSON",
    "supported_research_purpose": "Japanese cultural heritage records, digitized emakimono, folklore museum artifacts, and regional folklore archives.",
    "geographic_or_cultural_coverage": ["JP"],